video_id,title,publish_date,year,month,title_length
nHqeMW0iLBU,What was it like growing up in Dubai?,2025-11-01 12:32:25+00:00,2025,11,37
lYhi86Zaetg,The world's first website is still live...so retro.,2025-10-31 23:32:22+00:00,2025,10,51
cfOI7PBhkWk,How to Compete Against the Global Dev Talent Pool with Patrick Hartley [Podcast #195],2025-10-31 14:01:15+00:00,2025,10,85
fQ51cM44o7I,What does a double !! do in code?,2025-10-31 12:18:20+00:00,2025,10,33
vc5T3VmCar0,Playing chess is a lot like software development,2025-10-30 23:18:27+00:00,2025,10,48
9HOpanT0GRs,Harvard CS50’s Intro to Cybersecurity – Full University Course,2025-10-30 14:34:25+00:00,2025,10,62
svOjqXjMvGI,🧛Hoisting Horror! Everyone says variables are hoisted. So why does this break?,2025-10-30 11:52:27+00:00,2025,10,78
ykvHQwgCjro,Perfect image cropping every time...,2025-10-29 22:52:24+00:00,2025,10,36
Fr9GqFwl6NM,Kubernetes Course – Certified Kubernetes Administrator Exam Preparation,2025-10-29 15:53:38+00:00,2025,10,71
RwDvIaoJeAs,Why you should always negotiate - in the job search and in life,2025-10-28 23:29:27+00:00,2025,10,63
r6jVezXnBMQ,How to package yourself as a problem solver companies want to hire,2025-10-27 23:05:26+00:00,2025,10,66
xHUwGx-ZlTM,Serverless and Microservices with C# – Scalable Cloud Applications with Azure and .NET Aspire,2025-10-27 14:53:15+00:00,2025,10,93
utxq6LY1ero,Stop using padding hacks to make squares,2025-10-26 23:17:23+00:00,2025,10,40
FHBBaSUQk1Y,How contributing to Open Source can lead to tech jobs,2025-10-25 23:43:32+00:00,2025,10,53
baYjd4pFjlw,Learn how to make any div resizable,2025-10-24 23:32:22+00:00,2025,10,35
EO8QoyRSVaw,First dev job at 45 – Interview with self-taught freeCodeCamp grad Eric Carlson [Podcast #194],2025-10-24 14:00:20+00:00,2025,10,94
xJjxQjZTryI,Problem Solving for Beginners: Build Algorithms from Scratch with First Principles and JavaScript,2025-10-23 14:45:11+00:00,2025,10,97
xTg_pBgr_vA,"Danny Thompson's ""Why hire me"" experiment",2025-10-22 22:52:29+00:00,2025,10,41
83Kgx-Xe_DI,Make highlighted text match your brand or color scheme,2025-10-21 23:29:23+00:00,2025,10,54
xwI5OBEnsZU,Data Structures and Algorithms Mega Course – Master Technical Interviews in 49 Hours,2025-10-21 13:06:28+00:00,2025,10,84
Hfo5uvbmDaY,Flexbox spacing made easy,2025-10-20 23:05:25+00:00,2025,10,25
-VC3hIEL7eQ,SwiftUI Course for Beginners – Create an iOS App from Scratch,2025-10-20 14:12:03+00:00,2025,10,61
BRksIg2jkbo,How Ania Kubów uses time blocking to make the most of her day,2025-10-19 23:17:28+00:00,2025,10,61
-KRTTe__qy8,How to style your input cursor in CSS,2025-10-18 23:43:24+00:00,2025,10,37
Ufy1FyqvfKM,Audit the advice you're getting - it's not all gonna be good,2025-10-17 23:32:25+00:00,2025,10,60
hM2T45qbIPI,From injured athlete to software engineer with Kaleb Garner [Podcast #193],2025-10-17 14:00:06+00:00,2025,10,74
_dCn4WrWnBw,How to use Python's .isprintable() method,2025-10-16 23:18:24+00:00,2025,10,41
c6IyCwAV6BY,What is the JavaScript DOM?,2025-10-16 17:58:03+00:00,2025,10,27
Y9m_Chx1joE,"Why you should surround yourself with the smartest, most driven people",2025-10-15 22:52:59+00:00,2025,10,70
