video_id,title,publish_date,year,month,title_length
1Z-8HxlLAHk,Kids and young people: stay curious and be willing to engage with others,2026-03-30 12:17:27+00:00,2026,3,72
ehkDsePv3W8,Here's a cool and easy way to work with colors in your Three.js projects,2026-03-29 12:43:24+00:00,2026,3,72
uWRdzJTpcpI,Do web devs NEED to understand low-level programming concepts? Chris doesn't think so...,2026-03-28 12:32:40+00:00,2026,3,88
GC5CLCgnvm0,"When things are new and a little scary, embracing a beginner's mindset can help",2026-03-27 12:18:22+00:00,2026,3,79
tZef2ZzbyuQ,What happens when the model CAN'T fix it? Interview w/ software engineer Landon Gray [Podcast #213],2026-03-27 10:00:57+00:00,2026,3,99
GMytb7LNGOI,Learn a bit about camera position in Three.js,2026-03-26 11:52:29+00:00,2026,3,45
tchN4xa4pfg,AI Foundations for Absolute Beginners,2026-03-26 10:01:27+00:00,2026,3,37
x9oi7CG_i7E,A great novel can be written in any language - just like great programs.,2026-03-25 12:29:28+00:00,2026,3,72
R8h_gpSpEVU,Deploying AI Models with Hugging Face – Hands-On Course,2026-03-25 10:00:41+00:00,2026,3,55
CkbIIjplUvs,Have you ever heard of G-Code? Here's a quick explainer of what it is.,2026-03-24 12:05:23+00:00,2026,3,70
H_3sWUR9v7A,"LLMs haven't really gotten ""smarter"" - but the tools we use with them have",2026-03-23 12:17:34+00:00,2026,3,74
brLhhkUqcn4,Claude Code Essentials,2026-03-23 10:30:24+00:00,2026,3,22
TnBI8_6tmKg,Learn how to set a scene in Three.js,2026-03-22 12:43:37+00:00,2026,3,36
xtGThMTO9rI,Learning a new skill in your native language can be so powerful - and Sumit explains why,2026-03-21 12:32:21+00:00,2026,3,88
uJrh9GHrC38,The world still needs people who care - CodePen founder Chris Coyier interview [Podcast #212],2026-03-20 14:36:33+00:00,2026,3,93
H3i9DGnMxWQ,How do you find the balance between too much and too little in code and process reviews?,2026-03-20 12:18:21+00:00,2026,3,88
v7Butot2fHY,How to get started using Three.js,2026-03-19 11:52:35+00:00,2026,3,33
jydYq7oAtD8,"Software Testing Course – Playwright, E2E, and AI Agents",2026-03-19 10:01:20+00:00,2026,3,56
BiA08jfr4RU,"19 Web Dev Projects – HTML, CSS, JavaScript Tutorial",2026-03-18 13:26:39+00:00,2026,3,52
VWcCVKaN2vA,Learn the basics of LLMs in 60 seconds with Beau Carnes,2026-03-18 12:29:43+00:00,2026,3,55
WTw6NZDZ5mQ,"Build an E-Commerce Web App with Paystack, NextJS, Supabase",2026-03-17 16:00:12+00:00,2026,3,59
Fd4XR_EkDHc,"How JavaScript evolved to be able to handle more complexity, explained by Evan You",2026-03-17 14:57:07+00:00,2026,3,82
NWONA48L6_w,How to use the .rotateY() method in Three.js to make your 3D objects spin,2026-03-16 12:17:27+00:00,2026,3,73
NCfxtLZQSzA,"As a freelance dev, treat every email or phone call as if it could become 10 more",2026-03-15 12:43:21+00:00,2026,3,81
zDVWehHdkHE,How to use the .position() method in Three.js for perfect object placement,2026-03-14 12:32:34+00:00,2026,3,74
7yruIW4NvEQ,Sometimes you have to re-evaluate decisions you made 5 years (or 5 months!) ago in your codebase,2026-03-13 12:18:41+00:00,2026,3,96
IRcL5as-RaE,How to Land Freelance Clients with Small Business Whisperer Luke Ciciliano [Podcast #211],2026-03-13 10:00:27+00:00,2026,3,89
PiflojewvfU,How to use the .add() method in Three.js,2026-03-12 11:52:20+00:00,2026,3,40
lnycGFq8JQI,Our brains need to relax sometime - so find a way that works for you,2026-03-11 12:29:37+00:00,2026,3,68
uHNOqKdqQas,CI/CD in Production with Jenkins – Complete DevOps Course,2026-03-11 10:01:28+00:00,2026,3,57
CcrC5zSv1iA,"LLM Fine-Tuning Course – From Supervised FT to RLHF, LoRA, and Multimodal",2026-03-10 13:09:40+00:00,2026,3,73
E2oyLZVBcQw,"Why JavaScript is a ""glue"" language",2026-03-10 12:06:05+00:00,2026,3,35
0XMdbWy2j1w,Can you guess what this is? Wrong answers only!,2026-03-09 12:17:22+00:00,2026,3,47
ldkfMvE36FI,How to handle being thrown into an existing codebase and being expected to figure it out,2026-03-08 12:43:26+00:00,2026,3,88
jie_039IekA,"Why you shouldn't chase people to get what you need from them - info, payment, etc.",2026-03-07 13:32:30+00:00,2026,3,83
mrRfPVm9nAY,Learn the basics of Data Structures in 60 seconds with Beau Carnes.,2026-03-06 13:18:50+00:00,2026,3,67
hP931079TMw,There are 2 kinds of devs. One of them is screwed. Justin Searls interview [Podcast #210],2026-03-06 11:01:15+00:00,2026,3,89
tVskbekONlw,Learn MLOps with MLflow and Databricks – Full Course for Machine Learning Engineers,2026-03-05 14:21:18+00:00,2026,3,83
OGRyln02De4,Sometimes breaking your code and figuring out how to fix it is the best way to understand it,2026-03-05 12:52:31+00:00,2026,3,92
cw02dMpWStI,How to find good open source projects to contribute to - from Tapas Adhikary,2026-03-04 13:29:25+00:00,2026,3,76
0WjfKQdfeMU,NVIDIA-Certified Associate AI Infrastructure and Operations (NCA AIIO) Free Study Course,2026-03-04 11:00:02+00:00,2026,3,88
ZldNCx4AvEM,Learn the basics of Git in 60 seconds with Beau Carnes,2026-03-03 13:05:25+00:00,2026,3,54
E7o_WdfKszU,There's so much to learn - so how do you focus to get you closer to your goals?,2026-03-02 13:17:28+00:00,2026,3,79
IBTx5aGj-6U,Build Your Own Video Sharing App – Loom Clone with Next.js and Mux JavaScript Tutorial,2026-03-02 11:00:33+00:00,2026,3,86
c1Op7YSTwhg,How do you monetize open source? Evan You shares his tips.,2026-03-01 13:43:25+00:00,2026,3,58
Bc4blwgFF-o,Sometimes constraints in your learning translate into really focused action,2026-02-28 13:32:29+00:00,2026,2,75
TcZFJrjxOYQ,Can a single semicolon break an entire app?,2026-02-27 13:18:26+00:00,2026,2,43
s950xhRvqYQ,The ultimate dev skill is Integration Testing feat. Internet of Bugs [Podcast #209],2026-02-27 11:01:36+00:00,2026,2,83
Yygu7TBWdPs,Easily Create E2E Tests with KaneAI,2026-02-26 19:46:12+00:00,2026,2,35
_4uQI4ihGVU,Learn Kubernetes in 6 Hours – Full Course with Real-World Project,2026-02-26 13:58:14+00:00,2026,2,65
o54etZM-DrY,Programming isn't always fun - but you can still find joy in the boring bits,2026-02-26 12:52:35+00:00,2026,2,76
4RGkpzTJjfg,Contributing to open source has many benefits - but it doesn't guarantee you a job,2026-02-25 13:29:55+00:00,2026,2,82
UsfpzxZNsPo,Python Essentials for AI Agents – Tutorial,2026-02-25 11:00:52+00:00,2026,2,42
U6-RekkuORI,Closures in JavaScript explained with a simple backpack analogy,2026-02-24 13:05:28+00:00,2026,2,63
bB5eA7vU9W8,Learn Notion – Full Course for Beginners,2026-02-24 11:00:57+00:00,2026,2,40
Ai00MsNabaE,True or false: computers only understand 1s and 0s...?,2026-02-23 13:17:29+00:00,2026,2,54
QMgIovzpYVw,"When you're working, work hard. And when you relax, relax hard.",2026-02-22 13:43:36+00:00,2026,2,63
Tbqmz0ZP8q8,"Coding and chess are similar - they're both require deep thinking, patience, and creativity",2026-02-21 13:32:20+00:00,2026,2,91
uJAUeXLXHrY,Learn Regex basics in 60 seconds from Beau Carnes,2026-02-20 13:18:30+00:00,2026,2,49
kQqrMNviM9U,The three paths AI could take from here - Shawn Wang SWYX interview [Podcast #208],2026-02-20 11:01:18+00:00,2026,2,82
BrBMM2gIQN8,Prepping for interviews? Here are some practical tips to help you out.,2026-02-19 12:52:33+00:00,2026,2,70
fQbBPa0ADvs,Computer Networking Fundamentals Course,2026-02-18 15:00:57+00:00,2026,2,39
HEGrkgpe7-Y,JavaScript was famously designed in 10 days - so how'd it evolve to handle complex apps?,2026-02-18 13:29:33+00:00,2026,2,88
oRZouQxC5Gw,"When you're learning a new skill, you've gotta be consistent for long enough to make a difference",2026-02-17 13:10:39+00:00,2026,2,97
NDdCrvC79eg,Chess Strategy – Master the Italian Game and Avoid Common Traps,2026-02-16 14:36:05+00:00,2026,2,63
u1T8yyEEKWY,Learn SQL basics in 60 seconds from Beau Carnes,2026-02-16 13:17:29+00:00,2026,2,47
pdleuy5lljY,Knitting and coding may not seem related - but they are,2026-02-15 13:43:20+00:00,2026,2,55
wP8SiwiExBk,"What is Homebrew? It's not coffee, it's not beer, it's...a package manager!",2026-02-14 13:32:23+00:00,2026,2,75
UJjKVceWmdM,Knowing how to ask the right question is a valuable skill to cultivate,2026-02-13 13:18:29+00:00,2026,2,70
cjam-BWAaL8,Why maintaining a codebase is so damn hard – with OhMyZSH creator Robby Russell [Podcast #207],2026-02-13 11:01:10+00:00,2026,2,94
lEcULR30-GM,Master Full-Stack Docker & CI/CD – Build a Production-Ready Pipeline,2026-02-12 14:02:47+00:00,2026,2,68
7ysrM5BMe6Q,Don't get so wrapped up in the details that you forget the joy of coding,2026-02-12 12:52:59+00:00,2026,2,72
ug8W0sFiVJo,Hands-On Cybersecurity and Ethical Hacking – Full Course,2026-02-11 14:37:23+00:00,2026,2,56
KUbbb0T1YZ8,Have you ever wondered where Python got its name?,2026-02-11 13:29:30+00:00,2026,2,49
J7sQe2n0z6Q,Sometimes it's about balancing what your boss wants you to do with what you want to do,2026-02-10 13:05:25+00:00,2026,2,86
l57xKN6OBhY,Kubernetes Course – Certified Kubernetes Administrator Exam Preparation (2026 Update),2026-02-10 11:01:25+00:00,2026,2,85
2yF62QE59G8,AI tools aren't necessarily going to replace you - they're going to move you up the value chain,2026-02-09 13:17:45+00:00,2026,2,95
MtQhSMoHXMY,Why Vite needs a new bundler - from Evan You himself,2026-02-08 13:43:31+00:00,2026,2,52
56Hv0LDjtWM,Why humans are still necessary in the technical writing and research process,2026-02-07 13:32:19+00:00,2026,2,76
WbZDt-ubm48,"""This is what people mean by focus, ok!"" - Abbey, after being diagnosed with ADHD at 28",2026-02-06 13:18:26+00:00,2026,2,87
GAZkxw6DJJE,Tips from a 20-year developer veteran turned consultancy founder – Tapas Adhikary [Podcast #206],2026-02-06 11:00:27+00:00,2026,2,96
gmuTjeQUbTM,Harvard CS50 (2026) – Full Computer Science University Course,2026-02-05 13:45:14+00:00,2026,2,61
b_6KoSdgHiA,How much is a little loading spinner costing your website? It's worth thinking about...,2026-02-05 12:52:24+00:00,2026,2,87
Sk72ZCDAEsk,How a colleague helped Santosh realize he was performing at a higher level at work than his title,2026-02-04 13:29:22+00:00,2026,2,97
n1sfrc-RjyM,OpenClaw Full Tutorial for Beginners – How to Set Up and Use OpenClaw (ClawdBot / MoltBot),2026-02-04 11:01:21+00:00,2026,2,90
aokdrllzkFQ,"To understand what AI can do, we have to first understand what it CAN'T do.",2026-02-03 13:05:34+00:00,2026,2,75
h3nn7MsCmsQ,Being a manager isn't for everyone...,2026-02-02 13:17:28+00:00,2026,2,37
PBx-e7yyk5M,Why a good pitch matters as much as (or sometimes more than) the product itself,2026-02-01 13:43:21+00:00,2026,2,79
CcQwCGUdRmw,How presenting a project to industry partners got Alison and Cindy invited to GitHub Universe,2026-01-31 13:32:22+00:00,2026,1,93
xMrOFhk6Rng,Getting into computer science thanks to a supportive teacher and skipping a favorite class,2026-01-30 13:18:23+00:00,2026,1,90
MdEexYakkHw,"How can you, as a dev, get the most out of AI tools?",2026-01-29 12:52:39+00:00,2026,1,52
5y9nVwPwX_o,Raise your hand if you've been through these or other adjustments when starting remote work...,2026-01-28 13:29:32+00:00,2026,1,94
26ls5lNiijk,Relational Database Design – Full Course,2026-01-27 14:32:56+00:00,2026,1,40
boH7_Ate4LM,"Remember your first hackathon? While it was probably scary, you probably learned a ton.",2026-01-27 13:05:26+00:00,2026,1,87
D5F8kp_azzw,Let's Build Pipeline Parallelism from Scratch – Tutorial,2026-01-26 17:35:28+00:00,2026,1,56
0aKV-JGtDMA,It's easy to get sucked into working too much - but the costs become pretty clear pretty quickly.,2026-01-26 13:17:20+00:00,2026,1,97
ll1mpTJ4qBU,Why debugging vibe-coded projects is hard - and what to do instead,2026-01-25 13:43:36+00:00,2026,1,66
Y6JJgOqroAI,"Sure, grades matter in school - but on the job market, hands-on experience is more meaningful",2026-01-24 13:32:27+00:00,2026,1,93
4T3YlTSWa5s,How to stay curious as a dev in the AI hype era with Sumit Saha [Podcast #205],2026-01-23 14:30:03+00:00,2026,1,78
3GqiUg3Ree4,From not growing up with computers to senior engineer - thanks to Prince of Persia,2026-01-23 13:18:28+00:00,2026,1,82
I7_WXKhyGms,RAG & MCP Fundamentals – A Hands-On Crash Course,2026-01-22 14:27:46+00:00,2026,1,48
ojkbIKjRLIM,The challenges of turning a powerful braille learning prototype into real hardware,2026-01-22 12:52:23+00:00,2026,1,82
66hDgWottdA,Learn Dynamic Programming with Animations – Full Course for Beginners,2026-01-21 15:31:14+00:00,2026,1,69
2Kw3e-1vbBQ,Build your own The Backrooms horror game with Unreal Engine 5 & Blueprints – Full GameDev Tutorial,2026-01-20 17:39:36+00:00,2026,1,98
tVf_5pvz5ck,Be transparent about your career goals - it makes it easier for people to help you advance,2026-01-20 13:05:35+00:00,2026,1,90
ekXUXu7Eejs,"These days, you need more than just coding skills to get a good internship or job",2026-01-19 13:17:32+00:00,2026,1,81
l2Z9f42HGpY,Why you don't necessarily need to go to a big-name school to get into tech,2026-01-18 13:43:26+00:00,2026,1,74
Bufi2i2fLT0,You never know where career inspiration will come from,2026-01-17 13:32:23+00:00,2026,1,54
58Tn2xB8kIE,The Most Important Skills Going Forward with CTO + Homebrew Maintainer Mike McQuaid [Podcast #204],2026-01-16 14:30:05+00:00,2026,1,98
UtV8MfnuIEg,"The ""this"" keyword can be confusing in JavaScript. Do you understand how this works?",2026-01-16 13:18:25+00:00,2026,1,84
odP153inZUo,Build Your Own Kubernetes Operators with Go and Kubebuilder – Full Course,2026-01-15 17:41:46+00:00,2026,1,73
9tyZL5KIiGU,Why you should prioritize networking if you're in tech,2026-01-15 12:52:35+00:00,2026,1,54
3PD-vQbpwA8,Inside The World's Biggest Hackathon – Full Documentary on UC Berkeley's Cal Hacks,2026-01-14 17:28:53+00:00,2026,1,82
9KnVcWXUL8w,How to remove a list item by its value in Python,2026-01-14 13:29:37+00:00,2026,1,48
wck2LmaMaB4,Why cybersecurity basics are important for everyone to know - not just devs.,2026-01-13 13:05:25+00:00,2026,1,76
7G9q_5q82hY,How to Benchmark Embedding Models On Your Own Data,2026-01-12 16:38:04+00:00,2026,1,50
davl7UFG-Ls,Can you guess the output here?,2026-01-12 13:17:21+00:00,2026,1,30
RI8ELvtbUmU,"When you're learning or doing something new, get comfortable being uncomfortable",2026-01-11 13:43:40+00:00,2026,1,80
TFhGTw4RXI4,How to insert list items at a specific index in Python,2026-01-10 13:43:34+00:00,2026,1,54
DzVm161M4Kk,First developer job at age 38 with lawyer turned software engineer Zubin Pratap [Podcast #203],2026-01-09 14:30:11+00:00,2026,1,94
ry_mcAPVTOc,What's the difference between call vs apply in JavaScript?,2026-01-09 13:18:42+00:00,2026,1,58
keTcXT145CI,React Performance Optimization Patterns Course,2026-01-08 15:08:41+00:00,2026,1,46
tPeyD3ELDHw,Did you know - Harvard's CS50 isn't just a coding course. There are many variants...,2026-01-08 12:52:20+00:00,2026,1,84
HihwnUepmdg,Need some coding experience? Contribute to Open Source.,2026-01-07 13:29:25+00:00,2026,1,55
tr5Fapv80Cw,Building Agentic AI Workloads – Crash Course,2026-01-06 15:08:17+00:00,2026,1,44
DIRnYM2dOs0,Have you ever tried rubber duck debugging?,2026-01-06 13:08:42+00:00,2026,1,42
WSsOXo07LeE,OAuth 2.0 Course for Beginners,2026-01-05 16:03:15+00:00,2026,1,30
y5aKEyPfLKs,"The JavaScript ecosystem is huge - and Vue's founder, Evan You, is trying to simplify it",2026-01-05 13:24:09+00:00,2026,1,88
kFEBs8wuhiU,JavaScript coercion chaos at its finest,2026-01-04 13:55:51+00:00,2026,1,39
EQH9MBHGyag,Why it's important to take ownership of your work - the way Dr. David J Malan sees it,2026-01-03 13:32:21+00:00,2026,1,85
r36xQmTJe1c,"Music Production 101 – Master Sound Design, Mixing, and Mastering in FL Studio",2026-01-02 14:29:46+00:00,2026,1,78
HwFw1abJkUs,Here's a little array method mystery for you...,2026-01-02 13:18:24+00:00,2026,1,47
912L9KmzSLE,The advantages of being bilingual in tech,2026-01-01 12:52:41+00:00,2026,1,41
jHInoiWHe0Q,The RACECAR challenge - Ready: GO!,2025-12-31 13:29:32+00:00,2025,12,34
Fi8vnYgMiHA,So why should you still learn C programming in 2025 and beyond? Dr. David J. Malan has an answer.,2025-12-30 13:05:47+00:00,2025,12,97
8Si7eCfEpB0,Browsers fight over who renders HTML the best. Which one do you think usually wins?,2025-12-29 13:17:22+00:00,2025,12,83
lw1vTtFyfgg,All you need to start learning to code with freeCodeCamp is the will to do so.,2025-12-28 13:43:24+00:00,2025,12,78
w_BIYb6WbtU,Did you know that HTML doesn't care about mistakes?,2025-12-27 13:32:31+00:00,2025,12,51
Zo8AxO6sTQA,What's CS50's 72-hour Regret Clause? Dr. David J. Malan explains here.,2025-12-26 13:18:26+00:00,2025,12,70
Iapgr6t6Nv0,Candy cane conditional: everyone gets a candy cane only once the tree is decorated...,2025-12-25 12:52:30+00:00,2025,12,85
QZTOm8YVAW8,Which elf gets the candy cane?,2025-12-24 13:29:30+00:00,2025,12,30
WKIjkxxNH0c,Build a Support Agent with Vercel AI SDK – Full Tutorial,2025-12-23 16:11:53+00:00,2025,12,56
_fvW2bruZ2M,Take ownership. Advocate for yourself. Get to know the support team.,2025-12-23 13:05:27+00:00,2025,12,68
QCSKhLuGR5c,How to remove trailing characters from a Python string using the .rstrip() method,2025-12-22 13:17:20+00:00,2025,12,81
_-Tj3bPSYCI,How to get promoted as a dev w/out becoming a manager – Staff Engineer Santosh Yadav [Podcast #202],2025-12-22 12:40:45+00:00,2025,12,99
taSwtU-sldo,What happens when you spread a string in JavaScript?,2025-12-21 13:43:34+00:00,2025,12,52
FAKgFhWX8pQ,"This looks simple, but can you predict the output?",2025-12-20 13:32:25+00:00,2025,12,50
f9-Vf_WNvT0,How to check if a string only contains whitespace in Python,2025-12-19 13:18:33+00:00,2025,12,59
dSIVVX0vAsY,Unity 2D Pixel Art Game Tutorial,2025-12-18 14:58:24+00:00,2025,12,32
uNS75JWOmBI,Don't chase a path that looks good just because you feel like you're supposed to,2025-12-18 12:52:39+00:00,2025,12,80
vZHhmzT9TL8,How to use the .append() method in Python,2025-12-17 13:29:40+00:00,2025,12,41
Q7P20fHJlm4,Intro to Supabase – Full Tutorial for Beginners,2025-12-16 14:43:47+00:00,2025,12,47
qG2g1iv6ZbY,Event loop race: which one logs first?,2025-12-16 13:05:26+00:00,2025,12,38
N2nbig3WjAI,How to use the .title() method in Python,2025-12-15 13:17:30+00:00,2025,12,40
QgZoz4xFfLE,Array vs object gotcha in JavaScript,2025-12-14 13:43:24+00:00,2025,12,36
slfaeQLn1cY,It's both really hard and really easy to make money. How can this be?,2025-12-13 13:32:23+00:00,2025,12,69
lIghF_OewYg,"The ""AI is going to replace devs"" hype is over – 22-year dev veteran Jason Lengstorf [Podcast #201]",2025-12-12 14:01:21+00:00,2025,12,99
jF2FnVVc4AU,How to use the .swapcase() method in Python,2025-12-12 13:18:29+00:00,2025,12,43
UIf-SlmMays,n8n Tutorial – Zero to Hero Course,2025-12-11 15:34:06+00:00,2025,12,34
yhTipwdwe9w,Fun fact about JavaScript,2025-12-11 12:52:21+00:00,2025,12,25
kRv2ElPNAdY,From RNNs to Transformers: The Complete Neural Machine Translation Journey,2025-12-10 14:42:03+00:00,2025,12,74
fLnkVdDPgso,How to split a string in Python,2025-12-10 13:29:24+00:00,2025,12,31
9kKNFP9srjc,So how do closures work again...?,2025-12-09 13:05:16+00:00,2025,12,33
BMt-qvrEcFY,Build Serverless AI Agents with Langbase,2025-12-08 14:25:10+00:00,2025,12,40
gpm1hRv6WL8,The life of a software developer after work hours,2025-12-08 13:17:27+00:00,2025,12,49
ja4OAzPLuM8,Type coercion in JavaScript can get a little wild...,2025-12-07 13:43:22+00:00,2025,12,52
O3Q7WA38JXc,How to negotiate your salary like a pro using anchoring,2025-12-06 13:32:27+00:00,2025,12,55
VgBQ0yBSjfM,How to build your own learning path using Open Source with Kunal Kushwaha [Podcast #200],2025-12-05 13:45:05+00:00,2025,12,88
9UxVhurASxU,"The ""this"" keyword can be tricky. Ania helps you sort out one of its quirks here.",2025-12-05 13:18:28+00:00,2025,12,81
mAFoROnOfHs,Git & GitHub Crash Course for Beginners [2026],2025-12-04 16:19:42+00:00,2025,12,46
QpGTmAoEINA,Learning to code on the job - right in the browser,2025-12-04 12:52:33+00:00,2025,12,50
wu8npoU37cI,"Become an AI Researcher Course – LLM, Math, PyTorch, Neural Networks, Transformers",2025-12-03 14:28:01+00:00,2025,12,82
ikXDYsdg15c,Function declaration vs expression - what's the difference?,2025-12-03 13:29:23+00:00,2025,12,59
21_I-12f5JE,NestJS Course for Beginners - Build Server-Side Applications,2025-12-02 15:33:24+00:00,2025,12,60
zkJt9y7ixiY,AI tools can be super helpful - but they're not the answer to everything,2025-12-02 13:05:26+00:00,2025,12,72
g_3IKHG-rfA,Harvard CS50’s Intro to R Programming – Full University Course,2025-12-01 15:25:39+00:00,2025,12,62
OarYObjva0E,Only 6 values are falsey in JavaScript. Do you know what they are?,2025-12-01 13:17:33+00:00,2025,12,66
zfUP1tIC64o,"Some upcoming features for freeCodeCamp - Tom talks about daily coding challenges, streaks, & more.",2025-11-30 13:43:26+00:00,2025,11,99
URJBQ3b9n6Y,"Classic JavaScript gotcha: why does this print 3, 3, 3 instead of 0, 1, 2?",2025-11-29 13:32:19+00:00,2025,11,74
voPcxCFMbbM,How to teach yourself programming with GitHub's Andrea Griffiths [Podcast #199],2025-11-28 15:01:40+00:00,2025,11,79
08jTzcEMv_E,Move out of your parents' house ASAP? or stay if you can? Thomas discusses this with Quincy here.,2025-11-28 13:18:21+00:00,2025,11,97
_fGRKMQMl68,Code a turkey timer!,2025-11-27 12:52:21+00:00,2025,11,20
_coTZxZ-H5Q,Complete French Language Beginners Course – Learn A1 Level French,2025-11-26 14:11:45+00:00,2025,11,65
j-Mc04RlGXc,Pop quiz: does '5' equal 5 in code?,2025-11-26 13:29:18+00:00,2025,11,35
q4Ovbh3tpU0,Do something toward learning programming every day - even if it's just 10 minutes,2025-11-25 13:05:25+00:00,2025,11,81
nbsz6muQRT4,Learn CSS Flexbox in 2 Hours – Tutorial for Beginners,2025-11-24 14:44:43+00:00,2025,11,53
iMLGy2wEE_g,Can you guess what this code logs?,2025-11-24 13:17:33+00:00,2025,11,34
P6fLZFJsH7Y,What it's like living with daily migraines - and how Thomas manages them,2025-11-23 13:43:27+00:00,2025,11,72
EWHWX1yJsS0,Remember floppy disks?,2025-11-22 13:32:20+00:00,2025,11,22
GpxFF82I8Nk,When NOT to use AI in your hackathon project with MLH winners Cindy Cui and Alison Co [Podcast #198],2025-11-21 14:45:05+00:00,2025,11,100
MZVyASCY8sQ,Learn programming fundamentals first. Then you can use AI to help you become more efficient.,2025-11-21 13:18:21+00:00,2025,11,92
LsY7U2Muau8,Do you know who the first computer programmer was?,2025-11-20 12:52:30+00:00,2025,11,50
9q24hqwm4QM,From laser-etching microchips to rediscovering a love of coding,2025-11-19 13:29:26+00:00,2025,11,63
tdsQwuyS6DQ,"Create a Cute Room Portfolio with Blender, Three.js, JavaScript – Beginner Course",2025-11-19 12:11:33+00:00,2025,11,81
626BcUO84og,JavaScript Clean Code Course – Fix Code Smells & Refactor,2025-11-18 14:00:11+00:00,2025,11,57
zwzjaNmh-r4,Did you know that you can buy a domain name that's an emoji?,2025-11-18 13:05:24+00:00,2025,11,60
KOutPbKc9UM,Intro to Backend Web Development – Node.js & Express Tutorial for Beginners,2025-11-17 14:00:36+00:00,2025,11,75
H6gHXV6OgFU,How to get back into coding after years away,2025-11-17 13:17:35+00:00,2025,11,44
VplSjvnwG_Y,Boost your app's performance with CSS containment,2025-11-16 13:43:23+00:00,2025,11,49
I2LoiJWCKxc,Vue.js grew organically thanks in large part to the community - which Evan You discusses here.,2025-11-15 13:32:35+00:00,2025,11,94
ZK6XWSCCgPQ,Harvard CS50 prof David J. Malan on why you should learn programming slowly [Podcast #197],2025-11-14 15:01:11+00:00,2025,11,90
MkeawaniGts,Don't settle for boring text underlines...make them more fun!,2025-11-14 13:18:21+00:00,2025,11,61
G9JxuWk7BDA,Discrete Mathematics Course for Beginners,2025-11-13 14:14:28+00:00,2025,11,41
f0Yq_wF_cIQ,"If you're struggling, don't isolate yourself - find someone you can talk to.",2025-11-13 12:52:30+00:00,2025,11,76
GIZzRGYpCbM,n8n Course for Beginners – Build Complex Workflows & Master AI Integration,2025-11-12 14:00:26+00:00,2025,11,74
oeWLnnjFmf8,Guess how many bugs NASA's space shuttle software had?,2025-11-12 13:29:31+00:00,2025,11,54
a7B-JvPgTQs,This hackathon team built a tool to help blind and visually impaired people learn Braille,2025-11-11 13:05:37+00:00,2025,11,89
Kt2E8nblvXU,Learn Vue.js – Tutorial for Beginners,2025-11-10 15:54:13+00:00,2025,11,37
YXmDMqw7dYU,The HTML blink tag was SO annoying it got binned. The more you know...,2025-11-10 13:17:19+00:00,2025,11,70
suuDVhYXe5Y,How Ania built a course that teaches devs to code their own AI agents,2025-11-09 13:43:25+00:00,2025,11,69
f3UIwEZx47w,Z-index not working right? Here's how to fix your layering nightmares,2025-11-08 13:32:32+00:00,2025,11,69
rgt5GPFgryI,Perfectionism holds new developers back with Abbey Perini [Podcast #196],2025-11-07 15:01:43+00:00,2025,11,72
ealPKU_orJg,How to control underline spacing,2025-11-07 13:18:23+00:00,2025,11,32
mjXLt97_Cr8,"Guitar Theory Course for Beginners – Learn Fretboard, Major Scale and Triads",2025-11-06 16:13:41+00:00,2025,11,76
vK30T6wKauA,How to focus your efforts in the right directions when job hunting,2025-11-06 12:52:32+00:00,2025,11,66
FqJuiLbgqNA,Have you ever wondered why we call it a bug?,2025-11-05 13:29:30+00:00,2025,11,44
kb_scuDUHls,"Cryptography for Beginners - Full Python Course (SHA-256, AES, RSA, Passwords)",2025-11-04 15:35:10+00:00,2025,11,78
7lEWtEG3vd0,Why you should support your favorite open source projects,2025-11-04 13:05:31+00:00,2025,11,57
yhtdkuw9mbM,Creative Web Development with Three.js and Blender – 3D Portfolio for Beginners,2025-11-03 16:22:59+00:00,2025,11,79
siMP-22x5Ck,How to brand your form controls,2025-11-03 13:17:25+00:00,2025,11,31
et7u_tnlS0Q,The inventor of HTML gave away the web for free...,2025-11-02 13:43:24+00:00,2025,11,50
